{
  "query": {
    "range": {
      "createdAt": {
        "gte": "2026-08-12T22:00:00.000Z",
        "lt": "2026-08-13T22:00:00.000Z",
        "format": "strict_date_optional_time"
      }
    }
  },
  "sort": [
    {
      "id": {
        "order": "asc",
        "missing": "_last"
      }
    }
  ],
  "size": 100,
  "from": 0
}
