{
  "query": {
    "bool": {
      "must": [
        {
          "bool": {
            "must": [
              {
                "bool": {
                  "should": [
                    {
                      "term": {
                        "region.keyword": {
                          "value": "west",
                          "case_insensitive": true
                        }
                      }
                    },
                    {
                      "term": {
                        "region.keyword": {
                          "value": "east",
                          "case_insensitive": true
                        }
                      }
                    }
                  ],
                  "minimum_should_match": 1
                }
              },
              {
                "term": {
                  "status.keyword": {
                    "value": "active",
                    "case_insensitive": true
                  }
                }
              }
            ]
          }
        },
        {
          "bool": {
            "must_not": [
              {
                "bool": {
                  "must": [
                    {
                      "range": {
                        "quantity": {
                          "gte": 100
                        }
                      }
                    },
                    {
                      "range": {
                        "quantity": {
                          "lte": 999
                        }
                      }
                    }
                  ]
                }
              }
            ]
          }
        }
      ]
    }
  },
  "sort": [
    {
      "id": {
        "order": "asc",
        "missing": "_last"
      }
    }
  ],
  "from": 0,
  "size": 100
}
