{
  "query": {
    "bool": {
      "must_not": [
        {
          "bool": {
            "must": [
              {
                "bool": {
                  "should": [
                    {
                      "bool": {
                        "must_not": [
                          {
                            "term": {
                              "status.keyword": {
                                "value": "archived",
                                "case_insensitive": true
                              }
                            }
                          }
                        ]
                      }
                    }
                  ],
                  "minimum_should_match": 1
                }
              }
            ]
          }
        }
      ]
    }
  },
  "sort": [
    {
      "id": {
        "order": "asc",
        "missing": "_last"
      }
    }
  ],
  "from": 0,
  "size": 100
}
