{
  "query": {
    "bool": {
      "should": [
        {
          "bool": {
            "must_not": {
              "term": {
                "status.keyword": {
                  "value": "inactive",
                  "case_insensitive": true
                }
              }
            }
          }
        },
        {
          "bool": {
            "must_not": {
              "exists": {
                "field": "status"
              }
            }
          }
        }
      ],
      "minimum_should_match": 1
    }
  },
  "sort": [
    {
      "id": {
        "order": "asc",
        "missing": "_last"
      }
    }
  ],
  "size": 100,
  "from": 0
}
