{
  "query": {
    "bool": {
      "should": [
        {
          "bool": {
            "must_not": {
              "bool": {
                "should": [
                  {
                    "term": {
                      "status.keyword": {
                        "value": "inactive",
                        "case_insensitive": true
                      }
                    }
                  },
                  {
                    "term": {
                      "status.keyword": {
                        "value": "archived",
                        "case_insensitive": true
                      }
                    }
                  }
                ],
                "minimum_should_match": 1
              }
            }
          }
        },
        {
          "bool": {
            "must_not": {
              "exists": {
                "field": "status"
              }
            }
          }
        }
      ],
      "minimum_should_match": 1
    }
  },
  "sort": [
    {
      "id": {
        "order": "asc",
        "missing": "_last"
      }
    }
  ],
  "size": 100,
  "from": 0
}
