{
  "query": {
    "bool": {
      "must": [
        {
          "match_all": {}
        },
        {
          "range": {
            "age": {
              "gt": 30
            }
          }
        }
      ]
    }
  },
  "sort": [
    {
      "id": {
        "order": "asc",
        "missing": "_last"
      }
    }
  ],
  "size": 100,
  "from": 0
}
